{
  "$schema": "https://raw.githubusercontent.com/stackmuncher/stm_app/master/stackmuncher_lib/stm_rules/schemas/muncher.json",
  "line_endings": "unix",
  "language": "HTML",
  "bracket_only": [
    "^[[[:blank:]]%{/]*[{}\\[\\]\\(\\)<>][[:blank:];,%})]*$"
  ],
  "block_comments_start": [
    "^[[:blank:]]*<!--",
    "^[[:blank:]]*/\\*"
  ],
  "block_comments_end": [
    "-->",
    "\\*/[[:blank:]]*$"
  ]
}