{
  "$schema": "https://raw.githubusercontent.com/stackmuncher/stm_app/master/stackmuncher_lib/stm_rules/schemas/muncher.json",
  "line_endings": "unix",
  "language": "eRuby",
  "bracket_only": [
    "^[[:blank:]]*<%[[:blank:]]*$",
    "^[[:blank:]]*-?%>[[:blank:]]*$"
  ],
  "line_comments": [
    "^[[:blank:]]*-#.{5,}"
  ]
}