{
  "$schema": "https://raw.githubusercontent.com/rimutaka/stm/master/assets/schemas/muncher.json",
  "line_endings": "unix",
  "language": "C#",
  "keywords": [
    "\\babstract\\b",
    "\\badd\\b",
    "\\balias\\b",
    "\\bas\\b",
    "\\bascending\\b",
    "\\basync\\b",
    "\\bawait\\b",
    "\\bbase\\b",
    "\\bbool\\b",
    "\\bbreak\\b",
    "\\bby\\b",
    "\\bbyte\\b",
    "\\bcase\\b",
    "\\bcatch\\b",
    "\\bchar\\b",
    "\\bchecked\\b",
    "\\bclass\\b",
    "\\bconst\\b",
    "\\bcontinue\\b",
    "\\bdecimal\\b",
    "\\bdefault\\b",
    "\\bdelegate\\b",
    "\\bdescending\\b",
    "\\bdo\\b",
    "\\bdouble\\b",
    "\\bdynamic\\b",
    "\\belse\\b",
    "\\benum\\b",
    "\\bequals\\b",
    "\\bevent\\b",
    "\\bexplicit\\b",
    "\\bextern\\b",
    "\\bfalse\\b",
    "\\bfinally\\b",
    "\\bfixed\\b",
    "\\bfloat\\b",
    "\\bfor\\b",
    "\\bforeach\\b",
    "\\bfrom\\b",
    "\\bget\\b",
    "\\bglobal\\b",
    "\\bgoto\\b",
    "\\bgroup\\b",
    "\\bif\\b",
    "\\bimplicit\\b",
    "\\bin\\b",
    "\\bint\\b",
    "\\binterface\\b",
    "\\binternal\\b",
    "\\binto\\b",
    "\\bis\\b",
    "\\bjoin\\b",
    "\\blet\\b",
    "\\block\\b",
    "\\blong\\b",
    "\\bnameof\\b",
    "\\bnamespace\\b",
    "\\bnew\\b",
    "\\bnull\\b",
    "\\bobject\\b",
    "\\bon\\b",
    "\\boperator\\b",
    "\\borderby\\b",
    "\\bout\\b",
    "\\boverride\\b",
    "\\bparams\\b",
    "\\bpartial (method)\\b",
    "\\bpartial (type)\\b",
    "\\bprivate\\b",
    "\\bprotected\\b",
    "\\bpublic\\b",
    "\\breadonly\\b",
    "\\bref\\b",
    "\\bremove\\b",
    "\\breturn\\b",
    "\\bsbyte\\b",
    "\\bsealed\\b",
    "\\bselect\\b",
    "\\bset\\b",
    "\\bshort\\b",
    "\\bsizeof\\b",
    "\\bstackalloc\\b",
    "\\bstatic\\b",
    "\\bstring\\b",
    "\\bstruct\\b",
    "\\bswitch\\b",
    "\\bthis\\b",
    "\\bthrow\\b",
    "\\btrue\\b",
    "\\btry\\b",
    "\\btypeof\\b",
    "\\buint\\b",
    "\\bulong\\b",
    "\\bunchecked\\b",
    "\\bunmanaged\\b",
    "\\bunsafe\\b",
    "\\bushort\\b",
    "\\busing\\b",
    "\\bvalue\\b",
    "\\bvar\\b",
    "\\bvirtual\\b",
    "\\bvoid\\b",
    "\\bvolatile\\b",
    "\\bwhen\\b",
    "\\bwhere\\b",
    "\\bwhile\\b",
    "\\byield\\b"
  ],
  "bracket_only": [
    "^\\s*[{}\\[\\]][\\s;,]*$"
  ],
  "line_comments": [
    "^\\s*//\\s*.{10,}"
  ],
  "inline_comments": [
    "^[.[^/\n]]+\\s//\\s.{10,}"
  ],
  "doc_comments": [
    "^\\s+///\\s+.{8,}"
  ],
  "block_comments_start": [
    "(?i)^\\s*/\\*"
  ],
  "block_comments_end": [
    "(?i)\\*/\\s*$"
  ],
  "refs": [
    "^\\s*using\\s+([A-Za-z0-9_\\.]+);"
  ]
}