{
  "$schema": "https://raw.githubusercontent.com/rimutaka/stm/master/assets/schemas/muncher.json",
  "line_endings": "unix",
  "language": "SQL",
  "line_comments": [
    "^\\s*--\\s*.{10,}"
  ],
  "inline_comments": [
    "^.+--.{10,}$"
  ],
  "block_comments_start": [
    "(?i)^\\s*/\\*"
  ],
  "block_comments_end": [
    "(?i)\\*/\\s*$"
  ]
}