{
  "$schema": "https://raw.githubusercontent.com/stackmuncher/stm_app/master/stackmuncher_lib/stm_rules/schemas/muncher.json",
  "line_endings": "unix",
  "language": "Go",
  "bracket_only": [
    "^[[:blank:]]*[{}\\[\\]\\(\\)][\\s;,)]*$",
    "^[[:blank:]]*//[[:blank:]]*.{0,5}$"
  ],
  "line_comments": [
    "^\\s*//\\s*.{5,}"
  ],
  "inline_comments": [
    "^[.[^/\n]]+\\s//\\s.{10,}"
  ],
  "block_comments_start": [
    "(?i)^\\s*/\\*"
  ],
  "block_comments_end": [
    "(?i)\\*/\\s*$"
  ]
}