{
  "$schema": "https://raw.githubusercontent.com/rimutaka/stm/master/assets/schemas/muncher.json",
  "line_endings": "unix",
  "language": "Python",
  "line_comments": [
    "^\\s*#\\s*.{10,}"
  ],
  "refs": [
    "^\\s*import\\s+([A-Za-z0-9_\\.]+)",
    "^\\s*from\\s+([A-Za-z0-9_\\.]+)\\s+import\\s+([A-Za-z0-9_\\.]+)"
  ]
}