{
  "$schema": "https://raw.githubusercontent.com/stackmuncher/stm_app/master/stackmuncher_lib/stm_rules/schemas/muncher.json",
  "line_endings": "unix",
  "language": "PowerShell",
  "bracket_only": [
    "^\\s*[{}\\[\\]][\\s;,]*$"
  ],
  "line_comments": [
    "^\\s*#.{10,}"
  ],
  "inline_comments": [
    "^.+\\s+#.{5,}"
  ],
  "block_comments_start": [
    "^\\s*<#"
  ],
  "block_comments_end": [
    "^.*#>"
  ]
}